<?xml version="1.0" encoding="UTF-8"?>
<!--
Licensed to the Apache Software Foundation (ASF) under one
or more contributor license agreements.  See the NOTICE file
distributed with this work for additional information
regarding copyright ownership.  The ASF licenses this file
to you under the Apache License, Version 2.0 (the
"License"); you may not use this file except in compliance
with the License.  You may obtain a copy of the License at

http://www.apache.org/licenses/LICENSE-2.0

Unless required by applicable law or agreed to in writing,
software distributed under the License is distributed on an
"AS IS" BASIS, WITHOUT WARRANTIES OR CONDITIONS OF ANY
KIND, either express or implied.  See the License for the
specific language governing permissions and limitations
under the License.
-->

<theme name="flatgrey"
        xmlns:xsi="http://www.w3.org/2001/XMLSchema-instance"
        xsi:noNamespaceSchemaLocation="http://ofbiz.apache.org/dtds/widget-theme.xsd">
    <visual-themes>
        <visual-theme id="FLAT_GREY" display-name="Flat Grey">
            <description>Floating Layout, Sight-Impaired Accessible, Bidirectional</description>
            <screenshot location="/flatgrey/screenshot.jpg"/>
        </visual-theme>
    </visual-themes>
    <extends location="component://common-theme/widget/Theme.xml"/>

    <theme-properties>
        <!--template location-->
        <property name="VT_HDR_IMAGE_URL" value="/flatgrey/images/ofbiz_logo.gif"/>
        <!--javascript lib-->
        <property name="VT_HDR_JAVASCRIPT[+0]" value="/flatgrey/js/application.js"/>
        <!--Css style-->
        <property name="VT_STYLESHEET[+0]" value="/flatgrey/style.css"/>
        <property name="VT_STYLESHEET[+0]" value="/flatgrey/javascript.css"/>
        <property name="VT_HELPSTYLESHEET[]" value="/flatgrey/help.css"/>
        <property name="VT_DOCBOOKSTYLESHEET[]" value="/flatgrey/webapp/flatgrey/docbook.css"/>
        <property name="VT_RTL_STYLESHEET[]" value="/flatgrey/stylertl.css"/>
    </theme-properties>

</theme>